item_desc,item_id
Can you be over a relationship but not over the person you were in the relationship with?,413643
What is an in vivo winn assay?,272748
Why are people so fearful?,142043
Acting: What is the difference between film and theatre actors?,11135
If my mother get pregnant for my father's father what is the child to me?,71898
What are some great beginner ways to learn JavaScript?,158943
I'm currently on my summer break staying at the country of my birth (a third world country). How do I get myself back to being productive?,110826
What is the difference between drug abuse and drug addiction?,230753
What is the formula for the standard enthalpy of formation of naphthalene?,449321
What is anarchy-capitalism?,446997
I can only act and think in a short-term manner. How can I use it to my advantage to actually do something meaningful?,502583
What's the best way to sell art?,157482
Foo Fighters (band): Does Dave Grohl really sing the bridge of Monkey Wrench in one breath?,425897
What does it mean when a girl stares at me but doesn't smile?,387600
What’s the angle between hour hand and minute hand at 3: 45 pm?,510144
Does a laser transfer heat?,166736
"Since programming can be self-taught, why not major in something other than computer science?",444586
What is discipline centred approach?,182803
How can I secure glass to a piece of wood without using a frame?,490398
"Which bike is better in terms of durability and performance, the Apache 160 RTR or the Honda Trigger?",397704
What can make a car go slow down a hill?,439987
What are the main reasons why students from Duquesne University don't graduate on time?,504690
How does one become a lawyer in the US?,61200
Why did the Qing dynasty got overthrown?,256857
What do people in the military with non-combat roles do if they are attacked?,230288
"Why do Australia say the PCA ""have no jurisdiction over maritime boundaries""?",173501
Can we call centre of buyancy as centre of pressure in case if flOating body?,21888
How tax calculated in India? Is it based on profit or the total revenue?,234838
What are some tips for writing a novel?,26126
What is Hillary Clinton's stance on North Korea?,473729
How do I make a FaceTime call from my Mac?,62691
How risky is it to start a porn studio?,268585
I have habit of taking tea at 11.30 AM. If I'm missing to take at the time. Same evening am getting headache.How do I get rid of this?,432501
What are some leading research hypotheses on how the human brain can rapidly understand categories?,458738
Is Hotel Shivam Residency safe for unmarried couples?,506658
Does dandruff decrease by hair spa treatment?,62628
"When exporting/importing to other countries, which would the exporter/importer demand: dollars or the exporting/importing country's currency?",146124
Who are the most overrated figures in Indian History?,60614
What is an integrated MBA?,53392
What are the most important fiction books in history?,437274
How do I am able to forget my boyfriend?,108290
How does backpropagation happen in a feed-forward neural network?,43867
How can I get the public IP address of a user in Swift?,165535
Is the Karakoram Range part of the Great Himalayas?,275816
Which is the best beer available in India?,29569
How do I learn to express my emotions?,98968
Which colleges are best for studying economics in India?,57339
Do most women ejaculate?,296590
"If universe expands without limit and dark/vacuum/gravitational energy is created with it, is potential energy (the energy that can be created) infinite?",54575
Is trapezoid a cyclic quadrilateral?,228340
What kind of jobs do you get after doing a BSc programme in computer science from St. Stephens?,24066
Are you joining IIIT Bhubhaneswar this year (2016)? Pl tell your branch.,448347
How long should I take to learn the Italian language from A to Z?,228572
The terminal rated voltage in alternator is phase voltage or line voltage?,68542
Is it possible to score 100 marks in physics & chemistry on the JEE Main individually?,218749
How has the real estate industry been affected in India by the ban of 500/1000 notes?,102345
Is it possible to increase height after 25 using LOA? Anybody here has achieved this?,304214
Can someone identify this mushroom?,503418
When is the ideal time to take a pregnancy test? Are they more accurate if you wait longer?,117653
What colors are the 8 planets in our solar system?,207724
What's the worst experience you've had with car insurance companies?,269298
Why is skydiving expensive?,73802
What is the easiest way/trick to put contact lens in your eye?,110632
What product should Nest launch next?,324316
"What are some good old British humor TV series like ""Mind Your Language""?",425205
Would you consider dating your female best friend?,366679
What is the best PC game under 200mb?,52336
How does a diesel generator produce electricity?,507626
How did people in the olden days tune their musical instruments to a set frequency (eg 'C' note) without the help of electronic equipments?,461314
"Given a list of {D,S, G} set D , S, G D1,100,3 D2,200,4 … Find a sub-list of given list so that sum(S') /sum(G') <= X (ex. 100) and sum(G') is max?",85773
Why do some people feel high temperature of their bodies even when they don't have fever?,288249
Is infinity the last number?,242320
"Who made dowry system, boys or the girls?",250812
How can I become a good software engineer by myself?,169125
Do I have some language learning disorder if I can't learn a language to C1 level in 1 year?,357080
Was Donald Trump scared of Megyn Kelly?,90935
What is the difference between a criminal law and a civil law? Is murder a criminal offence or a civil offence?,357311
How do you find information sets in a normal form game?,375595
"What is Hillary Clinton's personal opinion on Trump? Politics aside, say, if the two of you just met on the street?",145843
What are some of the most common Indian names?,256900
Is psychiatry a ruse?,209167
Are traditional news outlets being replaced by internet news and social media news platforms?,496568
What are some cool Android phone hacks?,278444
How Can Holistic Medicine Help in Ragweed Allergies?,290144
Why do people tend to breathe louder while sleeping than while awake?,245169
What is Female Genital Mutilation (also referred to as female circumcision)?,201876
I want a real and effective way to make $ 500 per month with the knowledge that I have no money to invest?,4814
How does an Olympiad in mathematics affect placement at MNC's such as Google?,415714
Who would win in boxing Triple G vs Canelo?,319119
How do I program a video game?,141897
How do you buy a non-profit organization?,210964
What are some mind-blowing safe wallets 2016 that exist that most people don't know about?,43358
How do you make love?,130009
How do I add customization in WordPress?,365576
Do u believe in aliens?,71299
What are symptoms of social anxiety?,140831
"Electric Potential difference gives flow of charge then, Will Gravitational Potential difference give flow of time?",42310
How can I fix SSL connect error in MikTeX?,422846
What should I expect from laser hair removal?,467634
What can I do in my lunch break?,322776
Should I buy an Apple Macbook or a Windows laptop  for computer science in India?,374127
Is Klopp overrated?,159708
What are some of the most horror places in India?,174043
What are the best film festival for short films?,335609
"During the thirteen days after a death in a Korean family, does the soul remain present with their family members?",339468
Why isn't Hillary in prison?,19428
What is the best way to progress in life successfully?,267272
How do I become a lover?,409047
How does one know when to use HTML/CSS or Ruby on Rails?,442959
How profitable is Caltrain?,62378
"What is an ""unrated"" version of the Hollywood movies?",531597
"If no expense was spared, could a bungee cord system have saved people who had to jump from the WTC on 9/11?",527805
What is the best way to learn the German language?,40531
What are your favorite hip hop ad libs?,366509
What should 6 week old puppies be eating?,388609
Can there be something wrong health wise if your fingernails and toenails are darkening purple?,138067
"Have aliens not contacted Earth because they've fulfilled life's meaning, and become one with pre-universe?",218578
Who is the hero in Breaking Bad?,124925
What happens if there is a tie in electoral votes? Who decides the election?,318724
How do I get motivated to wake up ?,219250
What is the heat capacity of ice? How is this determined?,15108
What did people in the UK eat and drink before we English invented tea and curry?,468207
How can I test myself if I am an actor good enough to enter the profession of acting?,501422
"Can a chemical imbalance cause clinical depression, or is it just a gimmick used by pharmaceutical companies to sell antidepressants?",216992
What are some mind blowing inventions that most people dont know?,174550
"I masturbate 3-4 times a day, so my penis has become curved to the right. How can I make it straight?",140347
Is it normal to take omeprazole pills day after day during pregnancy?,227698
Do forex robots work?,483821
How hard/easy is it for a foreigner to get a research or faculty position at the university in Japan?,389698
What are the bitter truths about doing MBA in the US for an Indian?,10461
Does a strongly interacting dark matter which fills 'empty' space and is displaced by matter make too much sense for physicists to understand?,72319
What is the etymology of the suffix “-ism”?,471865
How do I calculate quantity of steel in R.C.C slab/column/beam from excel?,371097
How do I approach a girl and ask for her number?,445807
How do I get invitations to the show 'Comedy Nights with Kapils'?,134751
What is the best economy-class nespresso espresso machine on the market in 2013?,49787
What is the scope of SEO in India?,331177
Why does Apple force iOS users to have the Apple Watch app on their device?,195859
How do fake boobs feel?,434986
What is the most expensive wine in the world?,15674
Do you think Luffy will die at the end of One Piece? What would you prefer?,503734
What side of the bed do you sleep on?,422029
How is marmite made?,10542
Can a women live without sex?,43973
"For those in the SEO field, what is your daily routine like?",369727
Would a guy date me even with my ugly nose?,99718
"What hotel in Ooty Hill-station would be safe for unmarried couples, without the harassment of police, hotel staff, and moral police?",108755
What new balloons will appear in the 2016 Macy's Thanksgiving Day Parade?,119261
Does Robinhood allow margin stock buying?,516308
What are the best Squarespace templates for writers to showcase their work?,86516
Which is the app in iPhone where one can listen songs offline?,382180
Can I sleep on the side while wearing the Kokoon?,206002
Which is the best book for IES mechanical engineering?,478776
What is the biggest mistake you made in VIT?,205694
"On the Android YouTube app, can I search within a YouTube channel?",310542
"Can Safari for Mac view TIFF files, and how?",230956
Who are the top System Integrators in Asia (SE Asia to Japan) who specialise in IOT?,442702
What are the new hot research topics in cloud computing security for PhD students?,23772
How do you convert images from JPEG to HTML?,55028
What is Seth Godin's marketing philosophy?,390341
What can I do to make my hair thicker?,119302
"How do I answer the question ""Why do you want to leave your current company""?",347311
"What are some natural, legal alternatives to oxycodone in the USA?",502106
"Why does Trinity kill in ""Dexter""?",361953
What are some of the things that I should avoid in my 20s?,464276
"The Universe have a center, and is on expansion. Wouldn't be more precise to say The Universe could be infinite, but at a moment ""x"" he have an end?",72880
How can I get a lot of likes on Instagram?,405188
What were the strategies that Sardar Vallabhbhai Patel undertake while tackling the Nizam of Hyderabad?,417088
How are we connected to nature?,463442
What is your incest story?,185717
Is League of Legends a good game? Why or why not?,187179
Are there any IOS apps which can assist me with making a presentation in any capacity?,487309
What is the meaning of function?,118513
How much does a US nickel weigh?,161782
What is the cut off in BITS to take up a dual degree (B.E.+ Msc)?,273052
Where can I watch Sherlock Season 4 online?,6320
Can blogs with around ~200 pageviews a day make money with AdSense?,270855
"What do you do if you need to go to the bathroom on a plane, but the person in the aisle seat is sleeping?",221745
"Can my laptop run games such as GTA 5, Fallout 3/NV, Minecraft? If not what are some games that I can run?",487941
How do you give a woman multiple orgasms?,314831
What's the best picture of the stars you have taken?,352110
How should I proceed with my life?,177143
"A ball is thrown vertically upward and if the air resistance has to be taken in account, would the time of rising be greater or that of fall?",115381
How much time it will take for the beginners to learn the basic of guitars?,68923
Space Race: How close was Russia from landing on the moon and which cosmonaut would have been picked to walk on the moon?,123253
How do I get rid of these thoughts?,133769
Why do questions get marked for 'needing improvment' when they clearly don't?,58059
What are the best colleges in Mumbai?,158186
What is a long column?,307057
How can I sort numbers in an array in javascript without using sort()?,527711
Where can I get quality services in Australia for full color printed PVC sticker?,106151
Was Deckard a replicant in Blade Runner?,190171
How can I find electrical and P&ID drawings for CAT engine 3516B?,109134
What are some tips on making it through the job interview process at Uranium Energy?,398740
What are some of the best substitutes for non diastatic malt powder?,276174
I want to move to IT but I don’t know programming nor do I want to do programming. Are there any other career paths?,2885
"What is the meaning of the French phrase ""la belle""?",159328
How much money can one make through stock trading?,26033
Was there a person in a vegetative state but with full brain function who recounted his years of mental experience when he fully recovered?,42103
What is the best Google product to be used by an autistic person?,533359
Who is Star Lord's father?,364059
What are the best places to visit in Kerala for 3 to 4 days?,18743
Parents: How did you help your children to develop leadership skills?,69746
What's the most amount of money you've made in a week?,235814
Who would win between a lion and a gorilla?,332535
What is the best accounting course to take now?,19331
What do consultants do?,123210
What are some of the consequences caused by water pollution?,129990
What do Shahrukh Khan and Sahid Kapoor use on their hair?,513242
How do I change picture on Yahoo! Mail?,35645
How do I stop negative self talk from ruining my academic life?,122643
What are the main causes of dependent personality disorder?,494271
What is a police warrant?,479152
What is it that you are doing makes you different from others?,411074
I want to relocate from Delhi NCR to some other part in India. What are the possible options?,338509
"Why do guys take forever to text back, or they don't text back at all?",261126
How do you sharpen a hedge trimmer?,35418
"What is the difference between heart attack, heart failure and cardiac arrest?",287137
I am a good looking girl.  why do desperate guys try to flirt with me while cute guys ignore me?,447236
How do we know Martin Luther King Jr. admired Gandhi?,389049
Is Ireland a part of Great Britain?,300033
What is a current account?,377407
How can I become a stay at home dad?,73029
I love the taste of Raw Chicken. But people say it will it kill me. Are they just being too worried?,514050
Are there any reservations in the NMIMS?,529115
How much does it cost to rent store space in the Atlanta airport?,444938
How dangerous is hot air ballooning at night?,274681
Can anyone give me the link to the new Aadhar Payment App?,509371
What are the different types of stalkers?,461438
What are the ranks of the Navy SEALs?,392288
How can I become a good production engineer?,324322
Atheists: Should God be known through Science?,315527
"Which programming language should I concentrate more on, Java or Python?",183698
Why would someone block you on social media after they reject you?,209297
What are some examples of economic activity?,174662
Why does the KIIT University charge a very high fee?,343424
R ther specific rules or xtra documentation/paperwork needed fr an unmarried undr 30yr old girl travelling 2 UAE on visit visa sponsored by relative?,327932
"Does more effective mass mean more mass? If yes, because graphene has infinite effective mass has it infinite mass too?",199602
What Dyn DNS will do to protect themselves from future DDoS attacks?,305962
Why do people make fun of Chinese animation?,502100
Was the ruling of Faisal II the best period of the history of Iraq?,447603
"My Portuguese parent wants me (British, born and raised) to get a dual nationality with Portugal. What are the pros and cons to this?",54935
"If you were president, what is the first thing you would do?",216739
Why does the U.S. oppose the ruling by the UN International Court of Justice but support the ruling by the Permanent Court of Arbitration?,122624
Who decides what justice is and what injustice is and how do you make sure you are doing justice?,458165
What does it mean when a girl winkes at a boy?,497972
How do I get a job in ARAI?,79116
What is India's Current Account Deficit?,205238
What can we learn from Lord Krishna?,45739
What types of meat would a panda eat? Why?,122134
What is the job scope for someone who knows the Japanese language in India?,193844
"I am deeply in love with my boyfriend, but I have cheated on him twice with this other guy and haven't told him. We are all friends. What should I do?",336915
Marriage: Is a woman more affectionate towards her son or her husband?,89278
How did the 7 continents form?,455407
Where can I found a range of glazed windows and doors in Sydney to meet various fire resistant levels?,168242
How do I reset my email password?,6893
"What's the life expectancy of a Tesla Model S battery, and will there be a replacement plan of some sort?",311135
Can we finish Pakistan forever?,275320
Who is Margaret Hill Morris?,398102
"If you took the modern U.S. military with the supply capabilities against the German forces of WWII, how long would it take to win WWII?",84032
What should I do to live in Germany?,62408
Where can I buy a Tesla Powerwall in India?,416266
What are best practices for bug bounty programs?,231517
What happened in 2009 that increased the global popularity of K-pop?,47116
What is good in life?,504762
Do teen girls watch porn movies? And do they masturbate?,450882
What's a good substitute for Worcestershire sauce?,96168
What do you call a group of turtles?,104671
What is the best decision you have ever made?,142380
What are some of the best PG-13 rated movies to watch on Netflix?,90172
How do I win this?,362676
What is the placement percentage in pharmaceutical management from IIHMR?,369869
What is a best way to cook a roast?,183438
Which car is easy to drive automatic or manual?,262498
Why are most Quora answers so long?,7334
What is Bloomberg's vision and philosophy?,236310
Can a boy wear short shorts?,345368
"Since there are high functioning and low functioning sociopaths, are there moderate functioning sociopaths?",489246
What is so precious about the South China Sea that so many countries are laying claims on it?,222964
How can I lower my body temperature?,201873
What is the best reply to nawaj sarif from indian?,536272
Why won't my iPod Touch turn on? How do I fix it?,255599
What is the cheapest way to get to Berlin from Frankfurt International Airport?,492079
Why are pearl white cars trendy?,534381
How to do combustion reactions?,290991
What is this the symbol of?,287277
What makes a Labrador/German Shepherd mix a loyal companion?,379561
What is the procedure make a cell phone battery and how much cost to make battery? Is it possible to do manufacturing cell phone batteries in India?,472575
If I am talking on whatsapp call to someone and another person calls me on my whatsapp. what status will he get. will it show busy?,178475
I'm 72 & my upper arms are getting flabby what can I do?,146970
Who is @jobsinchinese on Twitter?,18964
Will we ever be able to manipulate gravity?,337695
A silverback gorilla vs a grizzly bear who wins?,213155
Should a shy person study in Paris for a semester?,217184
What is Aniracetam used for?,480475
What is swat equity for start up?,341723
What are the pain points of using a 10 year old OMS in the current market?,25905
Is there a prefix for 1/20 of something?,54614
How do we respect nature?,259259
Why is having a capybara as a pet illegal?,272582
What is your opinion on brexit?,7156
What's the most powerful/inspirational quote you've ever heard in Urdu?,380287
What did Chinese soldiers (in general) think of Americans soldiers in the Korean War?,21168
What does it feel like to live in America?,168119
What is the biggest Achievement you've made?,243832
"What's the ending of the tv show lost, I don't get it can some one explain it to me?",325726
What are the newest input and output devices?,426382
"What will be the exact salary per month for pay band ₹ 15,600-39,100 with grade pay of ₹ 5,400 ?",483561
Cheap accomodation in auckland?,367537
What can a man wear?,435587
What can an octopus see that a vertebrate can't due to the blind spot in vertebrate (including human) eyes where octopuses have no blind spot?,132134
What skills do I need to be a video game designer/animator?,16479
How do you type a check mark on a Mac?,295242
How much water drink per day?,134350
Sharad's brain is obstructing to get sufficient oxygen supply?,312618
What is the best online pharmacy for buying hydrocodone without a prescription?,126762
Do any economists believe $15/HR minimum wage would be good?,87455
How can I find people from Apple to talk to in person about their experience at the company while I am in the Bay Area?,388385
"Is there a known means by which I might alter my computer's date while retaining use of my internet browser? If so, what is it; how do I do it?",201490
Where does flash memory reside in a computer?,159902
What sorts of things do people often pass down from generation to generation? Why?,136421
What is the highest recorded download speed at any IIT?,348076
Why do I get jealous when my boyfriend meets with a pretty dentist? Am I immature if I feel that? What should I do?,524740
What is the difference between 1 pole mcb and 3 pole mcb?,241353
Is immortality possible from a scientific point of view (enhanced human)?,334548
What are the common questions asked during interviews?,125062
How often does the U.S. Census Bureau do a population census?,470217
Who will win the IPL in 2015?,412835
"I have a $100, where should I invest?",484827
How is argon used in welding?,25461
What led to the rise of the Mongol empire?,163769
What is the difference between rice vinegar and mirin?,453522
Do pandas contribute to the ecosystem?,155207
What is your normal morning routine?,49506
How can I stop slugs coming into my garden without killing them?,344693
How do you answer behavioural or situational interview questions?,353687
Why does accelerating charge radiate electromagnetic radiation?,344418
"My dad's cookie, chocolate, beverage company in Turkey has gone bankrupt. We are looking for company or someone to buy it. What else can we do?",311807
Which is the best website for writing blogs?,246898
What happens if you fly a plane through a cloud?,226701
"Every day, how many people start smoking cigarettes?",441719
Can a civilian use red and blue flashing lights on his vehicle?,457886
Does Amazon really give 3 lakh after joining as an SDE?,135696
What do Turks and Azerbaijanis think about Tajikistan?,499149
Will I get married?,372040
How do cooking soda and baking soda differ?,71441
"What is the salary of a mechanical engineering technician in Toronto, Canada?",188368
Should I use Slack or Trello to manage a team?,14048
Why is Game of Thrones exceptionally popular in the TV series?,19457
Why has Ukraine done so well in the Paralympics? And why do France perform so poorly?,243408
How many gigabytes of information about my life has the NSA's surveillance programs stored?,244413
What might a shadow and dark spot on a brain scan mean?,374044
How can you learn to think before you act or speak?,430752
What are the most interesting products and innovations that Sierra is coming out with in 2016?,437586
What is slyme?,368069
What are colloids? What are some examples?,264233
"What is stress, and how do I cope with it?",99253
Why do I get unhandled promise rejection while using http.get method in angular2?,406480
What weight loss regimen really works for obese people?,463964
"How do you correctly use ""who"" and ""whom""?",14751
When was the band Alice in Chains first formed?,535104
Which movie will win the 2015 Best Original Screenplay Academy Award and which movie should win?,519099
Why does an airplane need a tail?,126300
How do I make slime with Borax?,427062
How do eukaryotic and prokaryotic cells differ?,13240
How does airconsole.com works? Is it a simple websocket made on Node.js or any other technoglogy?,422319
When one politician accuses another of playing politics what does this mean?,110053
Why marketing is important?,98718
How does an Indian get to NASA?,41312
How do you translate “超市想诱导你购买不需要的东西” to English?,449903
What is the best audiology job provider in India?,194325
Love: How do you talk to someone without talking to someone?,526204
What are Daemon Tools?,202959
