item_desc,item_id
A direct competitor of mine in a geographically based service market approached me to buy their business. What should I think of this?,251113
Who is the best TV actor/actress?,77217
Which is better in term of Performance & Power. laptop i7 or desktop i7 for Graphic designing & Website Designing?,116204
Why does Ladder Logic fall short when tasks become complex and why isn't it the best for modular PLC programming?,185384
Was Hitler a Nazi?,138632
What is my vocal type? I’m a male and my vocal range is A2-C6?,480557
Is it possible to buy a 30 lakh car for a 24 year old with a current salary of 15k?,258133
"When you are an adult, what do you call a girlfriend?",246590
How can I reduce breast size?,217402
"Does 1,000000 exist?",328290
If I message someone on whatsapp then delete my account can I be blocked?,8018
How do I mix olive oil and ozone?,330299
Why we prefer English everywhere why can't hindi. In every interviews we have to speak in English even in Govt exams like CDS ssb?,124128
"Is the offshoring of manufacturing jobs a good thing or a bad thing, on balance? Why?",266873
"Is there any site to translate Telugu song ""Kanule Kanele"" lyrics in english?",521923
Why do people look different in each photo?,255140
What will parenting trends look like in 2017?,525378
Why don't we divide an array in 5 parts for merge sort?,394256
What do you wear with a striped maxi skirt?,267230
What is the procedure to get transcripts from Mumbai University?,94000
What are the most interesting products and innovations that Spectrum Brands is coming out with in 2016?,493622
Can you eat zucchini skin or should you peel it?,167983
What should be my approach to ace SSC CGL 2017 with 7 months in hand without coaching?,68061
Why are German Shepherds recommended when you have kids?,129046
Why do people always believe a hypocrite?,327308
Can lemons help whiten your teeth?,112883
How do I conduct morning assembly?,91388
How do I change the colour of the clock on my iPhone lockscreen?,201640
General surgery: I have severe stomach ache. This is the report of the ultrasound. Why do I have stomach ache?,451494
"What does ""begging the question"" mean?",268179
What's the hardest thing ever?,272751
In the future will we still see startups like WhatsApp or Snapchat that are actually fairly easy to build or can help you see a trend towards hardware or software that actually involves much more time to build a prototype?,22848
Which Country offers Good IT jobs for experienced Indian Expats and reasonably an easy entry to the country too?,249974
What is your review of Hell to Pay (2005 movie)?,39288
What is the way to know when your period is over?,257071
What is the solution of problem 30-5 in CLRS (3rd edition)?,242780
What does sex feel like to a man?,82221
Why is semolina gluten free?,512040
"Though ungentlemanly to attack the yellow jersey on the last stage of Tour de France, will the time actually count if the attack was successful?",227105
In Mission Impossible Rogue Nation there is no mention of Ethan Hunt's relationship with Julia Meade. Although my son thinks that at the end of Ghost Protocol it appears Julia has moved on to another relationship. Has this actually been confirmed by the filmmakers?,515331
How do I bring 1988 back by decorating a more grown up bedroom theme?,281943
Is Michio Kaku great?,525380
What are normal human flaws?,459768
No meaning jobs?,270397
Does Lord Shiva exist?,474532
What is corporative bank?,90056
What is some good pop music from Singapore?,206788
How can Microsoft Word be improved?,52688
How can I get B2B database resellers in UK?,264772
How can I get Indian voter id through online application? What's the procedure?,98411
Why do we have questions?,156719
"Who is better, Ronaldinho or Beckham?",443794
How can I watch the archived course in EDX or Coursera?,370100
What does representative democracy stand for?,91363
What is the most interesting investigation done by any police personnel?,36807
What is the difference between Ms. and Miss?,29566
How do barrier islands protect the mainland?,497528
How do you prove integration and differentiation?,139832
Which is worse: a tornado watch or a warning?,258754
"What is recommended after a workout - a hot shower, a cold shower or sauna? Why?",126934
Why can't I study English well?,99050
Is it true that blue eyed people are going extinct?,249681
What is the importance of human nature in philosophy?,177523
What would happen if I stop smoking all of a sudden?,414121
"I'm going to be doing phone bank work for Hillary Clinton. Is there generally a strict script for calls and if so, is it tested for efficacy?",316782
What is material dispersion in fiber optics?,515432
What is kitchkarma.com?,348702
What podcasts do you listen to?,496396
Should I participate in Infosys campus recruitment as a system engineer?,514881
What is the best thing you have ever read on quora.com?,23611
What are the most upvoted answers on Quora?,35678
Why should we help the needy?,414601
Who has been best person you met in Delhi college of engineering/ Delhi technological university?,142593
Can I naturally get pregnant at 49?,517531
Who is the greatest football player in Asia?,437831
Why don't planes use massive parachutes?,204068
What is the difference between a psychologist and a psychiatrist?”?,83107
Who forged the long-form birth certificate allegedly belonging to Barack Obama?,246644
Does Medusa have pubes and if so are they snakes too?,272635
How can I get WiFi on a Windows phone?,164669
How do I cut granite countertops?,391805
What is the best method to suicide without pain?,382917
Where should I get my website developed?,344126
Is it possible to put air suspension system to two wheeler vehicle?,303216
Why does being very warm in bed cause more vivid dreams?,289002
How would you pick locks?,299697
"If I have someone blocked on Instagram, and view their story, can they see I viewed it?",15846
What is there in the end of a rainbow?,107072
"What do you do on a 7-hour trip from Stowe, VT to Montauk, NY?",186050
How do I open a portal to another dimension?,214818
Which card is the best for winning every game?,269103
Looking For Escort Services in Ahmedabad?,468183
Is Interstellar about Elon Musk?,173570
How can I avoid deeper eyes?,234778
What's the molecular geometry of h2cs?,163875
Is Talbot School of Theology liberal? Why?,168415
Critical Thinking: Are you an independent thinker?,526403
"I want to name my company and i aminvolved in mechanical and civil work. So what I name my company means Enterprises, Engineering and Construction.?",305633
"What are the difference between heat pump, heat engine and refrigerator?",217507
Opinions on keen psychics?,422340
How can I get new SBI debit card pin without visiting branch?,59397
How do I prepare for SAT reading and writing section?,449885
"If 2 hours ago, it was as long after one o'clock in the afternoon as it was before one o'clock in the morning, what time would it be now?",141371
What is the Scope of Digital Marketing in India?,242191
Why is it that it is what it is?,321298
Where can you find Code Geass: Lelouch of the Rebellion dubbed into English?,198651
Do mainstream Christians believe the Mormon faith is a part of the Christian faith?,449564
Should I join Tech Citi Technologies for an internship?,502320
What risk management software do large proprietary trading firms use?,275177
Do atheists realize their belief system is their religion?,521370
Why is a Labrador/Great Dane mix so expensive?,410755
Is there any way to get share WhatsApp button from a website?,160705
Can I wear supporter all day?,6496
Is it possible to know when and how will I die?,122787
What I should gift to my girlfriend on her birthday?,459848
Why do people have this idea that good looking people are always amazing and lead 'perfect' lives?,219719
What are Kepler's Laws?,13030
What is list of CA firms in Aurangabad for articleship?,210573
"What are the main imports and exports of Venezuela, and how does Venezuela's industry compare to Peru's?",138328
What is the best library genesis for magazines?,272002
What role did Brazil play in World War II?,6347
What are some examples of hypertonic solutions?,41759
What are the top 10 TV shows ever made?,197369
How do people with disabilities (both physical and mental impairment) deal with their periods?,279368
What is the importance of automated teller machines?,173986
How should I increase my concentration power?,8982
Do I have photographic memory?,40384
What's the best way to learn SEO?,149481
How do you find garter snakes?,56109
I'm in a lot of debt and a few other problems that make life hard here. Can I just bug out to another country?,102444
Why am I not interested in anything?,473291
Until what age can a dog be given obedience training? I have a 8months old male pup who is quite hyper. Is he too old to cope up with training?,386442
What is a rear tire alignment?,259787
How do I get an IT job in Canada without visa?,98517
What makes medium-rare meat more popular than well-done meat in Western cultures despite its health concerns?,354016
Would Larry Bird be one of the best players in the NBA today?,371627
How painful are lip piercings?,518682
What are the pros and cons of Quora versus Stack Exchange?,274914
Which is the best YouTube channel for an SSC preparation?,358340
What role does Sora plays in Naruto Shippuden?,121726
Is the FBI “really” investigating Hillary Clinton?,70135
Are [math]RC[/math] and [math]LR[/math] circuits part of JEE Main syllabus?,341028
What are the tips and hacks for getting the classes that you want as a freshman at Buffalo State College?,413195
Can poverty be totally eliminated from india?,174765
What are the best unbiased News sources in the world?,158733
How can we make the world a better place for all and for the future generation to come?,93292
What are the job opportunities for an ME in software engineering in India?,218768
Is Andaaz Apna Apna overrated?,288410
What is the best laptop for student?,78157
Can Germans and Scandinavians understand each other?,293578
Why did MS Dhoni resign as ODI and T20 Captain?,12516
Why aren't hashtags on Instagram working?,262645
Is steel stronger or weaker than iron?,501515
Does my boyfriend really love me when he knows that I'm sad but he's never there for me?,361865
What countries have very similar looking flags?,58452
Why can some people draw what they see while others can't?,118697
What does the public think about mandatory seat belt laws and what are the current laws and enforcement techniques in Alabama?,454377
What are some good public libraries in Lucknow to go sit and read one's own books?,526541
It seemed obvious she wasn't interested. Did she say one thing but mean something else?,313154
What are some saturated solution examples?,515192
"Do I have a good chance of getting an attractive package in a placement, if I took a break after higher secondary and pursued BBA and MBA thereafter.",247796
Why are the bottoms of actors' feet always dirty?,112159
Is Kim Kardashian considered plus sized?,100324
Why is the weight limit on LATCH 40 lbs?,392315
What is the best thing about being a PhD?,262092
May I legally share with Quora users a letter that I received from a local politician?,532701
How can I evaluate [math]\int \frac{x^4+1}{x^6+1}\mathrm{d}x[/math]?,190857
What are the major differences between Chinese and Western cultures?,60277
What is it like to convert to Judaism?,537263
"Which is a better version, Xamidea or Xamidea simplified?",200419
What is a biomass?,434022
Where can I find transparent PNG files for all of the Apple Emoji icons?,170040
How can I get membership in PMI to start the certification course in my institute? What will be the formalities? How to contact theme.,296473
Which country among Russia and Japan have better relations with India?,265779
"Why does Amazon sell Amazon Kindle in India, when you need an international credit or debit card to buy it from Amazon and not from Amazon India?",206689
What physics branches help in cognitive science?,76047
Why do humans love to not eat humans?,47183
What are the benefits of being an ACM-ICPC world finalist?,486968
Why did Verizon acquire Yahoo?,254750
What are the best comprehensive online guides/tutorials/videos to learn computer networking for a beginner?,314398
What can be the Ways to improve English pronunciation & English speaking?,126174
Which Harry Potter character was the best written?,241727
How can I know if I have cancer?,132446
I had sex with my best friend. How can I repair our friendship?,13998
What is the best carpentry school in Canada?,376471
What is the best option after b.c.a?,398549
Is this considered plagiarism?,73124
Flowers for Algernon?,529288
What would life be like without an ego?,188714
How is science related to our daily life?,258752
How can I get rid of warts on an elbow?,472480
What do you think of the BHIM app?,512683
I need to make a development economics thesis. What is the most easy and simple topic to choose from? Is there any website where I can download data for analysis?,412167
Why was the planet Mercury given that name?,145760
What is the best way to close gaps between teeth without using braces?,470763
Why did the female Nazis not show compassion on the Jewish women and children they controlled?,96267
What is the best way to keep yourself always motivated?,160244
Why do most of the competitive programmers prefer C++ over Java when Java is more useful to learn as it is used in app development/web development?,504997
"Can I lose weight just by eating normal Indian home cooked food, coupled with about half an hour of running every morning?",145160
Are we being sensitive towards the use of the N word?,287933
"How much can you save working in Accenture, Infosys, TCS etc?",196724
What did you regret after graduating from college?,161602
How should I start to learn c language?,35905
Does class section change in 3rd year (bba) in ksom(kiit university)?,409944
What happened to Sammy in Dance Academy?,297727
"After demonetization of 500 and 1000 INR notes, will corruption stop, or in 2017, will donation start in school, college, jobs everywhere?",28446
Can you substitute granulated sugar for powdered sugar? Why or why not?,372529
Which is the toughest trek in Maharashtra?,398132
What are some of the best pictures?,345433
Why would my ex girlfriend try to follow me on Instagram then cancel the request?,327787
Why does batch normalization help?,122246
How do I understand what it means for me to be accelerating while sitting still on earth per general relativity?,532459
"Why is the affirmation, ""I'm proud to be white"" offensive?",174788
What are the limitations of capital asset pricing model?,485747
How do i get a blind date in any Indian major city?,311177
What is the type of engine used in flight?,454382
How much is a 1953 penny worth?,458688
How do you pronounce Katrina Kaif?,435959
What is real indian penis size?,384009
Which are the most fascinating modern infantry weapons?,527964
Why is in Europe the level of sulfide content not mentioned on wine bottles?,528754
What are the qualifications fo being an Indian Air Force pilot?,127331
What are the responsibilities of a board of directors?,68791
How do I drain out the blood from body (in a painless fashion) and hallucinate?,86424
How do I gain access to a private Instagram account?,21393
Can anyone help to find ways to get job after a failed start up within 6 months. I am a MBA graduate with 2 years experience in 3 companies?,369106
"Are we human beings aliens to planet earth? And if not, then are we acting so?",257979
Which circuit breaker is used in switchyard and why?,219136
"What is the first thing that comes to your mind when you hear the word ""Asia""?",220955
Which is the best online grocery shopping website in Hyderabad?,491208
Why do you like living in Scotland?,505861
Why are front-row guests asked to uncross their legs at a fashion show?,384591
Can a mortar shell be fired accurately without a barrel to direct its trajectory?,198295
How much does the average day trader make per day?,306505
How do I play music through Skype?,217349
Which moisturizer is best used for dry skin?,189521
How do you bounce back after hitting rock bottom?,447139
How can we use Pandora in India for free on a Windows Phone 10?,259196
What is the best book to learn quantum field theory on your own?,461009
"Which JS framework is best, Backbone, Ember or Angular?",333318
How do I celebrate my boyfriend's birthday?,295200
"Which are the top universities in world, where I can do post graduation in weapon & defense engineering?",177191
What must I do to strengthen the bone of peruvian rooster?,325883
What are the most interesting products and innovations that Resource America is coming out with in 2016?,208932
How can you talk off the record?,421993
Thinking about booking a trip to America. Have never been. What locations would you visit if you had three weeks?,251020
Which books should I read about computer science?,504472
"What is the difference between ""entrepreneurship"" and economic ""opportunism""?",469142
Where did Sita dumb himself?,279715
Which technology is better for face detection in ios (openGL ES vs core image vs core graphics)?,422647
How can I create such images?,95205
How does an Asian avoid smearing eyeliner on the hood of her upper eyelid?,182380
What financial ratios should I use to judge the balance sheet of a company (details in description)?,498207
What will future technology look like in 25-50 years?,264923
What is life like for a professional track and field athlete?,58893
What is SAP's technology stack?,265493
Why would someone's soul decide to kill the person?,378712
Which was the first IT company started in Bangalore?,512436
How does time have a direction?,157713
Were there some tensions among cities or provinces of the Roman Empire?,165353
"After a tubal ligation, how do you menstruate?",385120
Are depth charges still used in anti-submarine warfare?,154745
How much newly imported submarine will help Bangladesh defending its territory?,182553
How to crack jee in 9 months?,493102
Will you be okay if your political representative becomes rich or richer after being elected?,3501
"When Concorde accelerated to supersonic speeds, were passengers able to feel the the acceleration?",305294
What is the fastest way to learn to use LaTeX?,246526
How does Hipmunk make money?,475503
Is GEORGIA a good country to study for MBBS?,360455
What would happen if we suddenly stopped all wind on Earth and used energy to electrolyse water?,154819
What universities have master's programs in applied psychology (clinical/counseling psychology) in Germany?,73780
Is it the right time to invest in real estate?,485990
What's so special about India?,53145
What are some songs that really mean a lot to you?,379115
"I suddenly started feeling sensitivity to air that I inhale on my front tooth. Sensitivity (and slight pain) origins from the gum line (I personally feel so). Hot drinks don't pain or feel sensitive, cold drink does but very little. No visible sign of decay, tartar or caries. What's wrong?",224500
How do I deal with people who are skeptical about science and scientific methods?,515536
I got admission in b.tech agriculture engineering and in short time there is internal exam so how can I recover each topic for preparation?,409819
How do you feel when you see your girlfriend drink beer with 4 guys?,245833
How do you deal with nose hair as a man?,497591
Is there a way the play the iMessage games on jailbroken iOS 9.3.3?,340756
Why is WhatsApp Web disabled on Android tablets?,362394
Can I join the NIIT institute for a .Net course?,170393
What can I do to earn $100 per day?,286483
What are some tips on making it through the job interview process at Helix Energy Solutions?,325774
Which is best college for M.E in Tamil Nadu?,105433
Are Web Developers also considered to be software Developers?,138744
How can we reduce greenhouse gas emissions?,495446
"What are my online options to learn Abstract Algebra, Real Analysis, and other math classes that are not offered in Community College?",373063
What was the worst lie that you have ever been told about?,176536
How do you conduct market research?,243819
What is the procedure to get a study visa for Germany?,344271
How do you calculate BHP and HP?,192370
What is the average commute time in Indian cities?,145274
What are digitized microfiche?,170810
Is honey a non-vegetarian food?,277013
What is the kinkiest thing you have ever done?,350877
What are buscopan tablets used for?,251645
"Western Digital: I accidentally dropped my WD My Passport 1 TB hard drive. After connecting it to my system, I hear a clicking sound and the LED blinks, but it's not being detected. Has my drive failed? If so, how can I get my data back?",69936
How has Quora changed your view/belief of men?,142076
What do musicians think of the new musical notation system Hummingbird?,279660
How do I get on the board of directors for a non-profit?,277154
"I am a 2nd year computer science engineering student, how should I start my preparations for civil services exam?",129179
"My boyfriend calls me names, does he do this because he's insecure?",143727
I am preparing for IIT-JEE and I haven't joined any coaching. I already have HCV. Which book is nice for theory to clear basic concepts?,536038
What are the best fantasy English TV serials?,11799
What are some problems that India is most likely to face in the near future for which the country is completely unprepared?,107369
Is it possible to know the shareholders of a private company?,448866
What is a Photographer?,339462
What is the best diet plan and exercises to destroy belly fat completely?,183314
How do scanning electron microscopes function?,268962
How do I get rid of my masturbation habits?,238442
"Money Laundering: Are there ways to receive big deposits to my bank account, without being questioned about the origins of it?",404194
There is a graph with two nodes marked start and end. What are the minimum number of nodes at which a police check should be constructed so as to prevent a criminal from going from start to end?,267930
Are there any Olympic athletes who have competed in two different sports?,418460
How do I get an opportunity to act as a scribe to the blind children? Does anyone know about the Blind Schools/NGOs which provide such opportunities ?,179401
How do I learn to use a computer by myself?,129844
How do I write my CV as fresh computer engineer interested in software development?,175262
"What is a suitable solar panel installation provider near Los Molinos, California CA?",154873
What can be done to lower the use of internet data while watching videos?,411502
What is the best way to pay attention in a boring class?,416717
If kids born on 2008 and we both parents in UK since 10 years can we eligible for UK citizen?,211995
How many days does it take for money to be refunded to an HDFC credit card?,186851
"How do I show that the points (5,4), (-5,8), (-7,3) and (3,-1) are the vertices of a rectangle?",445675
Do thermal power plant engineers gets foreign placements in India?,445901
What is the most popular country for Quora?,319532
How can I sexually seduce a girl?,11772
What is John Locke's philosphy?,293029
What was it like growing up with famous parents?,312099
How does the spinal cord connect to the brain?,276850
How do I earn money through online games?,111238
Which is the most overrated Hollywood movie?,127554
Should I become an atheist?,203496
"Why all the planets in our solar system, are round?",165335
"Why do people throw garbage on the roads, corners, empty spaces or rather wherever they find a place?",385440
What is network marketing?,261568
What should you do if you love someone who doesn't love you?,320009
What are the ethical views of eating meat?,43772
Does connecting equipment that radiates RF to an outlet on a circuit different from the one to which a TV receiver is connected reduce interference?,284520
Should one learn Express.js or Sails.js?,315215
Would a woman in the Catholic Church be shunned or ostracized for having a sexual relationship with a priest?,1491
What causes sudden sadness?,230124
How do you submit a TV show idea to Netflix?,342357
What is the best health insurance policy?,188190
Which is the best way to download English songs for free?,461832
Do women like luxury watches as much as men do?,86019
"Given the inputs {1, 1, 2, 3} with the corresponding outputs {3, -3, 4, 4}, is the relation a function?",319766
What are some scientific observations that might suggest that we may be living in an imaginative world (like the Matrix)?,102248
Can a woman get pregnant just before her period?,14700
Do our perceptions misinterpret our sensations?,386250
Should I join the military after 30?,45252
What's the best cake to have by the ocean?,190329
Can I continue to use data on Jio SIM if it is used on a non VoLte phone?,59656
What are the best housekeeping methods?,480032
Should I buy a stock if it's PE ratio is in negative?,394183
Can you justify appointment of Mr. Urjit Patel as next RBI governer?,133136
"How should I prepare for a move from the SF Bay Area to Raleigh, NC?",352713
Is green tea better?,437317
"Why ads not showing on my YouTube video on mobile, ads showing desktop only why?",22669
What are some of the most beloved French/Francophone singers/songs/albums for children?,362563
Would you eat (more) farmed fish if it were sustainably raised?,346796
Are there any Pokemon games that can be played on Xbox 360?,206903
How much data is there on the Internet?,234908
What was the most expensive thing you ever bought?,54123
"The names Lesley/Leslie,Lydia,Cheryl and Mavis ,which one is better for someone who likes traveling and seeing movies?",148525
What was the issue before the U.S. Supreme Court in the case of McCulloch v. Maryland?,408751
